<?xml version="1.0" encoding="UTF-8"?>
<!-- XML Sample Message of message hierarchy                                          -->
<!-- Message:             ADC SAL Shipments Made v1.0 Rev. 6                          -->
<!-- Transaction:         AA - Audit Data Collection Rev. 271                         -->
<!-- Datamodel:           Audit Data Collection Datamodel, version HEAD Rev. 347      -->
<!-- XML tagset used:     AdcsML                                                      -->
<!-- Generated at:        02-05-2021 15:58:31                                         -->
<!-- Generated using:     EC-Design 2.5.0 (http://www.ec-design.nl)                   -->
<!-- Generated by:        Jan Vrijenhoek (Digitect)                                   -->
<!-- Organisation:        Digitect B.V. (Digitect)                                    -->
<!-- NOTE:    This sample message was generated automatically: manual modifications will be lost -->
<AdcSalShipmentsMade xsi:schemaLocation="http://schemas.iso.org/AdcsML/Messages/AdcSalShipmentsMade-v1 AdcSalShipmentsMade-v1.0.xsd"
		xmlns="http://schemas.iso.org/AdcsML/Messages/AdcSalShipmentsMade-v1"
		xmlns:xsi="http://www.w3.org/2001/XMLSchema-instance">
	<SalShpMade>
		<ShpId>SH1234</ShpId>
		<ShpNr>123456789</ShpNr>
		<FiscYr>2020</FiscYr>
		<AcntingPer>M1</AcntingPer>
		<DispOrgCd>D001</DispOrgCd>
		<ShpDt>2020-02-29</ShpDt>
		<ShpRefNr>123456789</ShpRefNr>
		<ShpngTrAmt>10000.0000</ShpngTrAmt>
		<ShpngTrCurCd>USD</ShpngTrCurCd>
		<ShpMthd>Air</ShpMthd>
		<Shipper>International Post</Shipper>
		<AdjInd>0</AdjInd>
		<AdjDscr>Final delivery.</AdjDscr>
		<CustAcntId>C00001</CustAcntId>
		<SalOrdId>ORD001</SalOrdId>
		<Crea>
			<UserId>JD</UserId>
			<Dt>2020-03-02</Dt>
			<Tm>09:31</Tm>
		</Crea>
		<Aprv>
			<UserId>JD</UserId>
			<Dt>2020-03-02</Dt>
			<Tm>09:31</Tm>
		</Aprv>
		<LstMdf>
			<UserId>JD</UserId>
			<Dt>2020-03-02</Dt>
			<Tm>09:31</Tm>
		</LstMdf>
		<BusSg>
			<BusSgCd>1234</BusSgCd>
		</BusSg>
	</SalShpMade>
</AdcSalShipmentsMade>
